{
  "$schema": "https://json-schema.org/draft/2020-12/schema",
  "$id": "https://pcs.sentinelops.ci/schemas/PFCoreRuntimeObservation.v0.schema.json",
  "title": "PFCoreRuntimeObservation.v0",
  "type": "object",
  "required": [
    "schema_version",
    "artifact_type",
    "observation_id",
    "trace_id",
    "event_id",
    "sequence",
    "observed_at",
    "principal",
    "action",
    "decision",
    "decision_reason",
    "policy_ref",
    "evidence_refs",
    "runtime_ref",
    "previous_event_hash",
    "payload_hash",
    "claim_class",
    "source_repo",
    "source_commit",
    "signature_or_digest"
  ],
  "additionalProperties": false,
  "properties": {
    "schema_version": { "$ref": "common.defs.json#/$defs/schema_version" },
    "artifact_type": { "const": "PFCoreRuntimeObservation.v0" },
    "observation_id": { "type": "string", "minLength": 1 },
    "trace_id": { "type": "string", "minLength": 1 },
    "event_id": { "type": "string", "minLength": 1 },
    "sequence": { "type": "integer", "minimum": 0 },
    "observed_at": { "$ref": "common.defs.json#/$defs/iso8601_datetime" },
    "principal": { "$ref": "pf_core.defs.json#/$defs/embedded_principal" },
    "action": { "$ref": "pf_core.defs.json#/$defs/embedded_action" },
    "decision": { "$ref": "pf_core.defs.json#/$defs/decision" },
    "decision_reason": { "type": "string" },
    "policy_ref": { "type": "string" },
    "evidence_refs": { "$ref": "common.defs.json#/$defs/ref_list" },
    "runtime_ref": { "type": "string", "minLength": 1 },
    "previous_event_hash": { "$ref": "pf_core.defs.json#/$defs/chain_hash" },
    "payload_hash": { "$ref": "common.defs.json#/$defs/hex_digest" },
    "claim_class": { "$ref": "pf_core.defs.json#/$defs/claim_class" },
    "source_repo": { "type": "string", "format": "uri" },
    "source_commit": { "type": "string", "minLength": 7 },
    "local_dev": { "type": "boolean" },
    "signature_or_digest": { "$ref": "common.defs.json#/$defs/hex_digest" }
  }
}
